STT,Thông tin,Label,thong_tin_norm_vi,tokens_vi,thong_tin_final_vi
576,"Chuyển đổi tư duy của người học, người học tốt nghiệp và viên chức, người lao động thông qua hoạt động đào tạo và nghiên cứu ứng dụng có chất lượng để làm phong phú thêm đời sống của người dân và các hoạt động nghề nghiệp tại Việt Nam vì một nền kinh tế bền vững và có mức sống cao hơn. Các hoạt động nghề nghiệp bao gồm nghề nghiệp của một cá thể, một ngành nghề, bất kỳ hoạt động thương mại, thương vụ hoặc xây dựng và vận hành doanh nghiệp.",Giới thiệu,chuyển đổi tư duy của người học người học tốt nghiệp và viên chức người lao động thông qua hoạt động đào tạo và nghiên cứu ứng dụng có chất lượng để làm phong phú thêm đời sống của người dân và các hoạt động nghề nghiệp tại việt nam vì một nền kinh tế bền vững và có mức sống cao hơn các hoạt động nghề nghiệp bao gồm nghề nghiệp của một cá thể một ngành nghề bất kỳ hoạt động thương mại thương vụ hoặc xây dựng và vận hành doanh nghiệp,"['chuyển_đổi', 'tư_duy', 'người', 'học', 'người', 'học', 'tốt_nghiệp', 'viên_chức', 'người', 'lao_động', 'thông_qua', 'hoạt_động', 'đào_tạo', 'nghiên_cứu', 'ứng_dụng', 'chất_lượng', 'để', 'làm', 'phong_phú', 'thêm', 'đời_sống', 'người_dân', 'hoạt_động', 'nghề_nghiệp', 'việt_nam', 'nền', 'kinh_tế', 'bền_vững', 'mức_sống', 'cao', 'hoạt_động', 'nghề_nghiệp', 'bao_gồm', 'nghề_nghiệp', 'cá_thể', 'ngành_nghề', 'bất_kỳ', 'hoạt_động', 'thương_mại', 'thương_vụ', 'hoặc', 'xây_dựng', 'vận_hành', 'doanh_nghiệp']",chuyển_đổi tư_duy người học người học tốt_nghiệp viên_chức người lao_động thông_qua hoạt_động đào_tạo nghiên_cứu ứng_dụng chất_lượng để làm phong_phú thêm đời_sống người_dân hoạt_động nghề_nghiệp việt_nam nền kinh_tế bền_vững mức_sống cao hoạt_động nghề_nghiệp bao_gồm nghề_nghiệp cá_thể ngành_nghề bất_kỳ hoạt_động thương_mại thương_vụ hoặc xây_dựng vận_hành doanh_nghiệp
577,"Bộ nhận diện thương hiệu mới của Trường Đại học Công nghiệp Thành phố Hồ Chí Minh (IUH) được thiết kế theo triết lý hiện đại –  kế thừa – phát triển, phản ánh bản sắc truyền thống và tầm nhìn tương lai của nhà trường.",Giới thiệu,bộ nhận diện thương hiệu mới của trường đại học công nghiệp thành phố hồ chí minh iuh được thiết kế theo triết lý hiện đại kế thừa phát triển phản ánh bản sắc truyền thống và tầm nhìn tương lai của nhà trường,"['bộ', 'nhận_diện', 'thương_hiệu', 'mới', 'trường', 'đại_học', 'công_nghiệp', 'thành_phố', 'hồ', 'chí_minh_iuh', 'thiết_kế', 'triết_lý', 'hiện_đại', 'kế_thừa', 'phát_triển', 'phản_ánh', 'bản_sắc', 'truyền_thống', 'tầm', 'nhìn', 'tương_lai', 'nhà_trường']",bộ nhận_diện thương_hiệu mới trường đại_học công_nghiệp thành_phố hồ chí_minh_iuh thiết_kế triết_lý hiện_đại kế_thừa phát_triển phản_ánh bản_sắc truyền_thống tầm nhìn tương_lai nhà_trường
578,"Biểu tượng chữ “I” cách điệu vừa đại diện cho “Industrial” – nền tảng lịch sử, vừa thể hiện “Innovation” – sứ mệnh đổi mới sáng tạo, kết hợp cùng hình khối vững chãi và bảng màu xanh – vàng đặc trưng, biểu trưng cho tri thức, khát vọng và phát triển bền vững.",Giới thiệu,biểu tượng chữ i cách điệu vừa đại diện cho industrial nền tảng lịch sử vừa thể hiện innovation sứ mệnh đổi mới sáng tạo kết hợp cùng hình khối vững chãi và bảng màu xanh vàng đặc trưng biểu trưng cho tri thức khát vọng và phát triển bền vững,"['biểu_tượng', 'chữ', 'cách_điệu', 'vừa', 'đại_diện', 'industrial', 'nền_tảng', 'lịch_sử', 'vừa', 'thể_hiện', 'innovation', 'sứ_mệnh', 'đổi_mới', 'sáng_tạo', 'kết_hợp', 'cùng', 'hình_khối', 'vững_chãi', 'bảng', 'màu', 'xanh', 'vàng', 'đặc_trưng', 'biểu_trưng', 'tri_thức', 'khát_vọng', 'phát_triển', 'bền_vững']",biểu_tượng chữ cách_điệu vừa đại_diện industrial nền_tảng lịch_sử vừa thể_hiện innovation sứ_mệnh đổi_mới sáng_tạo kết_hợp cùng hình_khối vững_chãi bảng màu xanh vàng đặc_trưng biểu_trưng tri_thức khát_vọng phát_triển bền_vững
579,"Hình ảnh ba mũi tên hướng lên thể hiện ba giá trị cốt lõi Innovation – Unity – Humanity, liên kết chặt chẽ trong tổng thể hiện đại. Mũi tên đầu tiên mang hình dáng máy bay cất cánh, biểu trưng cho hoài bão tuổi trẻ và hành trình chạm tới tri thức.",Giới thiệu,hình ảnh ba mũi tên hướng lên thể hiện ba giá trị cốt lõi innovation unity humanity liên kết chặt chẽ trong tổng thể hiện đại mũi tên đầu tiên mang hình dáng máy bay cất cánh biểu trưng cho hoài bão tuổi trẻ và hành trình chạm tới tri thức,"['hình_ảnh', 'ba', 'mũi_tên', 'hướng', 'lên', 'thể_hiện', 'ba', 'giá_trị', 'cốt_lõi', 'innovation', 'unity', 'humanity', 'liên_kết', 'chặt_chẽ', 'tổng', 'thể_hiện_đại', 'mũi_tên', 'đầu_tiên', 'mang', 'hình_dáng', 'máy_bay', 'cất_cánh', 'biểu_trưng', 'hoài_bão', 'tuổi_trẻ', 'hành_trình', 'chạm', 'tới', 'tri_thức']",hình_ảnh ba mũi_tên hướng lên thể_hiện ba giá_trị cốt_lõi innovation unity humanity liên_kết chặt_chẽ tổng thể_hiện_đại mũi_tên đầu_tiên mang hình_dáng máy_bay cất_cánh biểu_trưng hoài_bão tuổi_trẻ hành_trình chạm tới tri_thức
580,"Ba mũi tên đồng thời tạo hình ba chữ cái I – U – H, khẳng định bản sắc thương hiệu, tinh thần tiên phong và tầm nhìn chiến lược đổi mới – sáng tạo – phát triển bền vững.",Giới thiệu,ba mũi tên đồng thời tạo hình ba chữ cái i u h khẳng định bản sắc thương hiệu tinh thần tiên phong và tầm nhìn chiến lược đổi mới sáng tạo phát triển bền vững,"['ba', 'mũi_tên', 'đồng_thời', 'tạo_hình', 'ba', 'chữ_cái', 'u_h', 'khẳng_định', 'bản_sắc', 'thương_hiệu', 'tinh_thần', 'tiên_phong', 'tầm', 'nhìn', 'chiến_lược', 'đổi_mới', 'sáng_tạo', 'phát_triển', 'bền_vững']",ba mũi_tên đồng_thời tạo_hình ba chữ_cái u_h khẳng_định bản_sắc thương_hiệu tinh_thần tiên_phong tầm nhìn chiến_lược đổi_mới sáng_tạo phát_triển bền_vững
581,"Hình ảnh ba mũi tên hướng lên thể hiện ba giá trị cốt lõi Innovation – Unity – Humanity, liên kết chặt chẽ trong tổng thể hiện đại. Mũi tên đầu tiên mang hình dáng máy bay cất cánh, biểu trưng cho hoài bão tuổi trẻ và hành trình chạm tới tri thức. Trong bố cục, ba mũi tên đồng thời tạo hình ba chữ cái I – U – H, khẳng định bản sắc thương hiệu, tinh thần tiên phong và tầm nhìn chiến lược đổi mới – sáng tạo – phát triển bền vững.",Giới thiệu,hình ảnh ba mũi tên hướng lên thể hiện ba giá trị cốt lõi innovation unity humanity liên kết chặt chẽ trong tổng thể hiện đại mũi tên đầu tiên mang hình dáng máy bay cất cánh biểu trưng cho hoài bão tuổi trẻ và hành trình chạm tới tri thức trong bố cục ba mũi tên đồng thời tạo hình ba chữ cái i u h khẳng định bản sắc thương hiệu tinh thần tiên phong và tầm nhìn chiến lược đổi mới sáng tạo phát triển bền vững,"['hình_ảnh', 'ba', 'mũi_tên', 'hướng', 'lên', 'thể_hiện', 'ba', 'giá_trị', 'cốt_lõi', 'innovation', 'unity', 'humanity', 'liên_kết', 'chặt_chẽ', 'tổng', 'thể_hiện_đại', 'mũi_tên', 'đầu_tiên', 'mang', 'hình_dáng', 'máy_bay', 'cất_cánh', 'biểu_trưng', 'hoài_bão', 'tuổi_trẻ', 'hành_trình', 'chạm', 'tới', 'tri_thức', 'bố', 'cục', 'ba', 'mũi_tên', 'đồng_thời', 'tạo_hình', 'ba', 'chữ_cái', 'u_h', 'khẳng_định', 'bản_sắc', 'thương_hiệu', 'tinh_thần', 'tiên_phong', 'tầm', 'nhìn', 'chiến_lược', 'đổi_mới', 'sáng_tạo', 'phát_triển', 'bền_vững']",hình_ảnh ba mũi_tên hướng lên thể_hiện ba giá_trị cốt_lõi innovation unity humanity liên_kết chặt_chẽ tổng thể_hiện_đại mũi_tên đầu_tiên mang hình_dáng máy_bay cất_cánh biểu_trưng hoài_bão tuổi_trẻ hành_trình chạm tới tri_thức bố cục ba mũi_tên đồng_thời tạo_hình ba chữ_cái u_h khẳng_định bản_sắc thương_hiệu tinh_thần tiên_phong tầm nhìn chiến_lược đổi_mới sáng_tạo phát_triển bền_vững
582,"Hệ thống tổ chức của Trường Đại học Công nghiệp TP.HCM được xây dựng theo mô hình quản trị hiện đại, gồm các đơn vị chức năng và các đơn vị đào tạo, phối hợp chặt chẽ nhằm đảm bảo hoạt động đào tạo, nghiên cứu khoa học và quản lý được triển khai hiệu quả, thống nhất và minh bạch.",Giới thiệu,hệ thống tổ chức của trường đại học công nghiệp tp hcm được xây dựng theo mô hình quản trị hiện đại gồm các đơn vị chức năng và các đơn vị đào tạo phối hợp chặt chẽ nhằm đảm bảo hoạt động đào tạo nghiên cứu khoa học và quản lý được triển khai hiệu quả thống nhất và minh bạch,"['hệ_thống', 'tổ_chức', 'trường', 'đại_học', 'công_nghiệp', 'tp', 'hcm', 'xây_dựng', 'mô_hình', 'quản_trị', 'hiện_đại', 'gồm', 'đơn_vị', 'chức_năng', 'đơn_vị', 'đào_tạo', 'phối_hợp', 'chặt_chẽ', 'nhằm', 'đảm_bảo', 'hoạt_động', 'đào_tạo', 'nghiên_cứu', 'khoa_học', 'quản_lý', 'triển_khai', 'hiệu_quả', 'thống_nhất', 'minh_bạch']",hệ_thống tổ_chức trường đại_học công_nghiệp tp hcm xây_dựng mô_hình quản_trị hiện_đại gồm đơn_vị chức_năng đơn_vị đào_tạo phối_hợp chặt_chẽ nhằm đảm_bảo hoạt_động đào_tạo nghiên_cứu khoa_học quản_lý triển_khai hiệu_quả thống_nhất minh_bạch
583,"Sơ đồ bộ máy tổ chức: đứng đầu là Ban lãnh đạo, bên dưới có các phòng ban, khoa, viện, trung tâm, phân hiệu và đoàn thể.",Giới thiệu,sơ đồ bộ máy tổ chức đứng đầu là ban lãnh đạo bên dưới có các phòng ban khoa viện trung tâm phân hiệu và đoàn thể,"['sơ_đồ', 'bộ_máy', 'tổ_chức', 'đứng', 'đầu', 'ban', 'lãnh_đạo', 'bên', 'dưới', 'phòng_ban', 'khoa_viện', 'trung_tâm', 'phân_hiệu', 'đoàn_thể']",sơ_đồ bộ_máy tổ_chức đứng đầu ban lãnh_đạo bên dưới phòng_ban khoa_viện trung_tâm phân_hiệu đoàn_thể
584,Ban lãnh đạo gồm có Đảng ủy và Ban Giám hiệu.,Giới thiệu,ban lãnh đạo gồm có đảng ủy và ban giám hiệu,"['ban', 'lãnh_đạo', 'gồm', 'đảng_ủy', 'ban_giám_hiệu']",ban lãnh_đạo gồm đảng_ủy ban_giám_hiệu
585,"Phòng ban gồm: Phòng Tổ chức - Hành chính, Phòng Tài chính - Kế toán, Phòng Kế hoạch - Đầu tư, Phòng Đào tạo, Phòng quản lý khoa học và hợp tác quốc tế, Phòng Công tác chính trị và hỗ trợ sinh viên, Phòng Khảo thí và Đảm bảo chất lượng, Phòng quản trị, Phòng Dịch vụ, Phòng Quản lý Ký túc xá, Tạp chí Khoa học và Công nghệ-IUH, Nhà xuất bản Đại học Công Nghiệp TP.HỒ CHÍ MINH. ",Giới thiệu,phòng ban gồm phòng tổ chức hành chính phòng tài chính kế toán phòng kế hoạch đầu tư phòng đào tạo phòng quản lý khoa học và hợp tác quốc tế phòng công tác chính trị và hỗ trợ sinh viên phòng khảo thí và đảm bảo chất lượng phòng quản trị phòng dịch vụ phòng quản lý ký túc xá tạp chí khoa học và công nghệ iuh nhà xuất bản đại học công nghiệp tp hồ chí minh,"['phòng_ban', 'gồm', 'phòng', 'tổ_chức', 'hành_chính', 'phòng', 'tài_chính', 'kế_toán', 'phòng', 'kế_hoạch', 'đầu_tư', 'phòng', 'đào_tạo', 'phòng', 'quản_lý', 'khoa_học', 'hợp_tác', 'quốc_tế', 'phòng', 'công_tác', 'chính_trị', 'hỗ_trợ', 'sinh_viên', 'phòng', 'khảo_thí', 'đảm_bảo', 'chất_lượng', 'phòng', 'quản_trị', 'phòng', 'dịch_vụ', 'phòng', 'quản_lý', 'ký_túc_xá', 'tạp_chí', 'khoa_học', 'công_nghệ', 'iuh', 'nhà_xuất_bản', 'đại_học', 'công_nghiệp', 'tp', 'hồ', 'chí_minh']",phòng_ban gồm phòng tổ_chức hành_chính phòng tài_chính kế_toán phòng kế_hoạch đầu_tư phòng đào_tạo phòng quản_lý khoa_học hợp_tác quốc_tế phòng công_tác chính_trị hỗ_trợ sinh_viên phòng khảo_thí đảm_bảo chất_lượng phòng quản_trị phòng dịch_vụ phòng quản_lý ký_túc_xá tạp_chí khoa_học công_nghệ iuh nhà_xuất_bản đại_học công_nghiệp tp hồ chí_minh
586,"Viện gồm có 4 đơn vị: Viện Đào tạo Quốc tế Sau đại học, Viện Tài chính - Kế toán, Viện Công nghệ Sinh học và Thực phẩm, Viện Khoa học Công nghệ và Quản lý Môi trường.",Giới thiệu,viện gồm có đơn vị viện đào tạo quốc tế sau đại học viện tài chính kế toán viện công nghệ sinh học và thực phẩm viện khoa học công nghệ và quản lý môi trường,"['viện', 'gồm', 'đơn_vị', 'viện', 'đào_tạo', 'quốc_tế', 'sau_đại_học_viện', 'tài_chính', 'kế_toán_viện', 'công_nghệ_sinh_học', 'thực_phẩm', 'viện', 'khoa_học', 'công_nghệ', 'quản_lý', 'môi_trường']",viện gồm đơn_vị viện đào_tạo quốc_tế sau_đại_học_viện tài_chính kế_toán_viện công_nghệ_sinh_học thực_phẩm viện khoa_học công_nghệ quản_lý môi_trường
587,"Khoa gồm có 15 đơn vị: Khoa Công nghệ cơ khí, Khoa Công nghệ thông tin, Khoa Công nghệ Điện, Khoa Công nghệ Điện tử, Khoa Công nghệ Động lực, Khoa Công nghệ Nhiệt - Lạnh, Khoa Công nghệ May - Thời trang, Khoa Công nghệ Hóa học, Khoa Khoa học Cơ bản, Khoa Luật và Khoa học chính trị, Khoa Ngoại ngữ, Khoa Quản trị Kinh doanh, Khoa Thương mại - Du lịch, Khoa Kỹ thuật xây dựng, Khoa Khoa học sức khỏe.",Giới thiệu,khoa gồm có đơn vị khoa công nghệ cơ khí khoa công nghệ thông tin khoa công nghệ điện khoa công nghệ điện tử khoa công nghệ động lực khoa công nghệ nhiệt lạnh khoa công nghệ may thời trang khoa công nghệ hóa học khoa khoa học cơ bản khoa luật và khoa học chính trị khoa ngoại ngữ khoa quản trị kinh doanh khoa thương mại du lịch khoa kỹ thuật xây dựng khoa khoa học sức khỏe,"['khoa', 'gồm', 'đơn_vị', 'khoa', 'công_nghệ', 'cơ_khí', 'khoa', 'công_nghệ_thông_tin', 'khoa', 'công_nghệ', 'điện_khoa', 'công_nghệ', 'điện_tử_khoa', 'công_nghệ', 'động_lực', 'khoa', 'công_nghệ', 'nhiệt_lạnh', 'khoa', 'công_nghệ', 'may', 'thời_trang_khoa', 'công_nghệ', 'hóa', 'học_khoa', 'khoa_học_cơ_bản', 'khoa', 'luật', 'khoa_học', 'chính_trị', 'khoa', 'ngoại_ngữ', 'khoa', 'quản_trị', 'kinh_doanh', 'khoa', 'thương_mại', 'du_lịch', 'khoa', 'kỹ_thuật', 'xây_dựng', 'khoa', 'khoa_học', 'sức', 'khỏe']",khoa gồm đơn_vị khoa công_nghệ cơ_khí khoa công_nghệ_thông_tin khoa công_nghệ điện_khoa công_nghệ điện_tử_khoa công_nghệ động_lực khoa công_nghệ nhiệt_lạnh khoa công_nghệ may thời_trang_khoa công_nghệ hóa học_khoa khoa_học_cơ_bản khoa luật khoa_học chính_trị khoa ngoại_ngữ khoa quản_trị kinh_doanh khoa thương_mại du_lịch khoa kỹ_thuật xây_dựng khoa khoa_học sức khỏe
588,"Trung tâm gồm có 6 đơn vị: Trung tâm Quản trị Hệ thống, Trung tâm Thông tin - Truyền thông, Trung tâm Ngoại ngữ, Trung tâm giáo dục Quốc phòng và Thể chất, Trung tâm Thư viện, Trung tâm Nghiên cứu và Phát triển công nghệ - Máy Công nghiệp.",Giới thiệu,trung tâm gồm có đơn vị trung tâm quản trị hệ thống trung tâm thông tin truyền thông trung tâm ngoại ngữ trung tâm giáo dục quốc phòng và thể chất trung tâm thư viện trung tâm nghiên cứu và phát triển công nghệ máy công nghiệp,"['trung_tâm', 'gồm', 'đơn_vị', 'trung_tâm', 'quản_trị', 'hệ_thống', 'trung_tâm', 'thông_tin', 'truyền_thông', 'trung_tâm', 'ngoại_ngữ', 'trung_tâm', 'giáo_dục', 'quốc_phòng', 'thể_chất', 'trung_tâm', 'thư_viện', 'trung_tâm', 'nghiên_cứu', 'phát_triển', 'công_nghệ', 'máy', 'công_nghiệp']",trung_tâm gồm đơn_vị trung_tâm quản_trị hệ_thống trung_tâm thông_tin truyền_thông trung_tâm ngoại_ngữ trung_tâm giáo_dục quốc_phòng thể_chất trung_tâm thư_viện trung_tâm nghiên_cứu phát_triển công_nghệ máy công_nghiệp
589,"Phân hiệu gồm có 5 đơn vị: Phân hiệu Quảng Ngãi, Cơ sở Thanh Hóa, Cơ sở Phạm Văn Chiêu, Cơ sở Nguyễn Văn Dung, Cơ sở Nhơn Trạch.",Giới thiệu,phân hiệu gồm có đơn vị phân hiệu quảng ngãi cơ sở thanh hóa cơ sở phạm văn chiêu cơ sở nguyễn văn dung cơ sở nhơn trạch,"['phân_hiệu', 'gồm', 'đơn_vị', 'phân_hiệu', 'quảng_ngãi', 'cơ_sở', 'thanh_hóa', 'cơ_sở', 'phạm_văn_chiêu', 'cơ_sở', 'nguyễn_văn_dung', 'cơ_sở', 'nhơn_trạch']",phân_hiệu gồm đơn_vị phân_hiệu quảng_ngãi cơ_sở thanh_hóa cơ_sở phạm_văn_chiêu cơ_sở nguyễn_văn_dung cơ_sở nhơn_trạch
590,"Đoàn thể gồm có 3 đơn vị: Công đoàn, Đoàn thanh niên, Hội sinh viên.",Giới thiệu,đoàn thể gồm có đơn vị công đoàn đoàn thanh niên hội sinh viên,"['đoàn_thể', 'gồm', 'đơn_vị', 'công_đoàn', 'đoàn', 'thanh_niên', 'hội', 'sinh_viên']",đoàn_thể gồm đơn_vị công_đoàn đoàn thanh_niên hội sinh_viên
591,"Đảng ủy nhà trường do đồng chí Phan Hồng Hải giữ chức vụ Bí thư Đảng ủy.
",Giới thiệu,đảng ủy nhà trường do đồng chí phan hồng hải giữ chức vụ bí thư đảng ủy,"['đảng', 'ủy', 'nhà_trường', 'đồng_chí', 'phan_hồng_hải', 'giữ', 'chức_vụ', 'bí_thư', 'đảng', 'ủy']",đảng ủy nhà_trường đồng_chí phan_hồng_hải giữ chức_vụ bí_thư đảng ủy
592,Đồng chí Phạm Trung Kiên giữ vai trò Phó Bí thư Đảng ủy.,Giới thiệu,đồng chí phạm trung kiên giữ vai trò phó bí thư đảng ủy,"['đồng_chí_phạm', 'trung_kiên_giữ', 'vai_trò', 'phó', 'bí_thư', 'đảng', 'ủy']",đồng_chí_phạm trung_kiên_giữ vai_trò phó bí_thư đảng ủy
593,"Ban Thường vụ Đảng ủy có sự tham gia của các đồng chí Nguyễn Xuân Hồng và Huỳnh Trung Hiếu.
",Giới thiệu,ban thường vụ đảng ủy có sự tham gia của các đồng chí nguyễn xuân hồng và huỳnh trung hiếu,"['ban', 'thường_vụ', 'đảng_ủy', 'sự', 'tham_gia', 'đồng_chí', 'nguyễn_xuân_hồng', 'huỳnh_trung_hiếu']",ban thường_vụ đảng_ủy sự tham_gia đồng_chí nguyễn_xuân_hồng huỳnh_trung_hiếu
594,Đồng chí Hoàng Đơ đảm nhiệm 2 vai trò vừa là Ủy viên Thường vụ và vừa là Chủ nhiệm Ủy Ban Kiểm Tra.,Giới thiệu,đồng chí hoàng đơ đảm nhiệm vai trò vừa là ủy viên thường vụ và vừa là chủ nhiệm ủy ban kiểm tra,"['đồng_chí', 'hoàng_đơ', 'đảm_nhiệm', 'vai_trò', 'vừa', 'ủy_viên', 'thường_vụ', 'vừa', 'chủ_nhiệm', 'ủy', 'ban', 'kiểm_tra']",đồng_chí hoàng_đơ đảm_nhiệm vai_trò vừa ủy_viên thường_vụ vừa chủ_nhiệm ủy ban kiểm_tra
595,"Ban Chấp hành Đảng ủy bao gồm các đồng chí có kinh nghiệm và năng lực trong công tác quản lý và tổ chức. Các Ủy viên Ban Chấp hành Đảng ủy gồm Dương Tiến Đoàn, Nguyễn Thị Thương và Phạm Thị Quế Minh.
",Giới thiệu,ban chấp hành đảng ủy bao gồm các đồng chí có kinh nghiệm và năng lực trong công tác quản lý và tổ chức các ủy viên ban chấp hành đảng ủy gồm dương tiến đoàn nguyễn thị thương và phạm thị quế minh,"['ban_chấp_hành', 'đảng_ủy', 'bao_gồm', 'đồng_chí', 'kinh_nghiệm', 'năng_lực', 'công_tác', 'quản_lý', 'tổ_chức', 'ủy_viên', 'ban_chấp_hành', 'đảng_ủy', 'gồm', 'dương', 'tiến_đoàn', 'nguyễn_thị_thương', 'phạm_thị', 'quế_minh']",ban_chấp_hành đảng_ủy bao_gồm đồng_chí kinh_nghiệm năng_lực công_tác quản_lý tổ_chức ủy_viên ban_chấp_hành đảng_ủy gồm dương tiến_đoàn nguyễn_thị_thương phạm_thị quế_minh
596,"Ban Chấp hành Đảng ủy còn có sự tham gia của các đồng chí Trần Đình Thắng, Lê Minh Hùng, Lê Ngọc Sơn, Nguyễn Huy Phúc, Nguyễn Trường Thi, Nguyễn Trung Nhân và Lê Văn Hoàng.
",Giới thiệu,ban chấp hành đảng ủy còn có sự tham gia của các đồng chí trần đình thắng lê minh hùng lê ngọc sơn nguyễn huy phúc nguyễn trường thi nguyễn trung nhân và lê văn hoàng,"['ban_chấp_hành', 'đảng', 'ủy', 'còn', 'sự', 'tham_gia', 'đồng_chí', 'trần_đình_thắng', 'lê_minh_hùng', 'lê_ngọc', 'sơn', 'nguyễn_huy_phúc', 'nguyễn_trường', 'thi', 'nguyễn_trung_nhân', 'lê_văn_hoàng']",ban_chấp_hành đảng ủy còn sự tham_gia đồng_chí trần_đình_thắng lê_minh_hùng lê_ngọc sơn nguyễn_huy_phúc nguyễn_trường thi nguyễn_trung_nhân lê_văn_hoàng
597,"Ban Giám hiệu - Đại học Công nghiệp TP.HCM gồm có PGS.TS. Phan Hồng Hải là Hiệu trưởng nhà Trường, PGS.TS. Đàm Sao Mai và TS. Nguyễn Xuân Hồng là Phó Hiệu trưởng nhà Trường.",Giới thiệu,ban giám hiệu đại học công nghiệp tp hcm gồm có pgs ts phan hồng hải là hiệu trưởng nhà trường pgs ts đàm sao mai và ts nguyễn xuân hồng là phó hiệu trưởng nhà trường,"['ban', 'giám_hiệu', 'đại_học', 'công_nghiệp', 'tp', 'hcm', 'gồm', 'pgs', 'ts', 'phan_hồng_hải', 'hiệu_trưởng', 'nhà_trường', 'pgs', 'ts_đàm', 'sao', 'mai', 'ts', 'nguyễn_xuân_hồng', 'phó', 'hiệu_trưởng', 'nhà_trường']",ban giám_hiệu đại_học công_nghiệp tp hcm gồm pgs ts phan_hồng_hải hiệu_trưởng nhà_trường pgs ts_đàm sao mai ts nguyễn_xuân_hồng phó hiệu_trưởng nhà_trường
