STT,Thông tin,Label,thong_tin_norm_vi,tokens_vi,thong_tin_final_vi
199,Trường Đại học Công nghiệp Thành phố Hồ Chí Minh ký kết hợp tác cùng Công ty ABB Robotics Việt Nam,Tin tức,trường đại học công nghiệp thành phố hồ chí minh ký kết hợp tác cùng công ty abb robotics việt nam,"['trường', 'đại_học', 'công_nghiệp', 'thành_phố', 'hồ', 'chí_minh', 'ký_kết', 'hợp_tác', 'cùng', 'công_ty', 'abb', 'robotics', 'việt_nam']",trường đại_học công_nghiệp thành_phố hồ chí_minh ký_kết hợp_tác cùng công_ty abb robotics việt_nam
200,Tập huấn công tác Công đoàn tại Trường Đại học Công Nghiệp Thành phố Hồ Chí Minh năm 2023,Tin tức,tập huấn công tác công đoàn tại trường đại học công nghiệp thành phố hồ chí minh năm,"['tập_huấn', 'công_tác', 'công_đoàn', 'trường', 'đại_học', 'công_nghiệp', 'thành_phố', 'hồ', 'chí_minh', 'năm']",tập_huấn công_tác công_đoàn trường đại_học công_nghiệp thành_phố hồ chí_minh năm
201,Công bố Quyết định bổ nhiệm và Quyết định bổ nhiệm lại viên chức Quản lý,Tin tức,công bố quyết định bổ nhiệm và quyết định bổ nhiệm lại viên chức quản lý,"['công_bố', 'quyết_định', 'bổ_nhiệm', 'quyết_định', 'bổ_nhiệm', 'viên_chức', 'quản_lý']",công_bố quyết_định bổ_nhiệm quyết_định bổ_nhiệm viên_chức quản_lý
202,Diễn tập thoát nạn cho 300 người ở Trường Đại học Công nghiệp TP.HCM,Tin tức,diễn tập thoát nạn cho người ở trường đại học công nghiệp tp hcm,"['diễn_tập', 'thoát', 'nạn', 'người', 'trường', 'đại_học', 'công_nghiệp', 'tp', 'hcm']",diễn_tập thoát nạn người trường đại_học công_nghiệp tp hcm
203,Sinh viên Khoa Công nghệ Điện xuất sắc đạt giải Nhì cuộc thi MECA 2023,Tin tức,sinh viên khoa công nghệ điện xuất sắc đạt giải nhì cuộc thi meca,"['sinh_viên', 'khoa', 'công_nghệ', 'điện', 'xuất_sắc', 'đạt', 'giải', 'nhì', 'cuộc', 'thi', 'meca']",sinh_viên khoa công_nghệ điện xuất_sắc đạt giải nhì cuộc thi meca
204,Hội thảo Sinh viên Nghiên cứu Khoa học Khoa Công nghệ Nhiệt Lạnh lần thứ 5 – 2023,Tin tức,hội thảo sinh viên nghiên cứu khoa học khoa công nghệ nhiệt lạnh lần thứ,"['hội_thảo', 'sinh_viên', 'nghiên_cứu', 'khoa_học_khoa', 'công_nghệ', 'nhiệt_lạnh', 'lần', 'thứ']",hội_thảo sinh_viên nghiên_cứu khoa_học_khoa công_nghệ nhiệt_lạnh lần thứ
205,Ngành Kỹ thuật điện và Năng lượng tái tạo sau khi ra trường làm gì?,Tin tức,ngành kỹ thuật điện và năng lượng tái tạo sau khi ra trường làm gì,"['ngành', 'kỹ_thuật', 'điện', 'năng_lượng', 'tái_tạo', 'sau', 'ra', 'trường', 'làm', 'gì']",ngành kỹ_thuật điện năng_lượng tái_tạo sau ra trường làm gì
206,Hội nghị sơ kết giữa nhiệm kỳ thực hiện Nghị quyết Đại hội Đảng bộ Trường Đại học Công nghiệp Thành phố Hồ Chí Minh,Tin tức,hội nghị sơ kết giữa nhiệm kỳ thực hiện nghị quyết đại hội đảng bộ trường đại học công nghiệp thành phố hồ chí minh,"['hội_nghị', 'sơ_kết', 'giữa', 'nhiệm_kỳ', 'thực_hiện', 'nghị_quyết', 'đại_hội', 'đảng_bộ', 'trường', 'đại_học', 'công_nghiệp', 'thành_phố', 'hồ', 'chí_minh']",hội_nghị sơ_kết giữa nhiệm_kỳ thực_hiện nghị_quyết đại_hội đảng_bộ trường đại_học công_nghiệp thành_phố hồ chí_minh
207,IUH ký kết hợp tác toàn diện cùng  Liên hiệp Hợp tác xã Thương mại Thành phố Hồ Chí Minh (Sài Gòn CO.OP),Tin tức,iuh ký kết hợp tác toàn diện cùng liên hiệp hợp tác xã thương mại thành phố hồ chí minh sài gòn co op,"['iuh', 'ký_kết', 'hợp_tác', 'toàn_diện', 'cùng', 'liên_hiệp', 'hợp_tác_xã', 'thương_mại', 'thành_phố', 'hồ', 'chí_minh', 'sài_gòn', 'co', 'op']",iuh ký_kết hợp_tác toàn_diện cùng liên_hiệp hợp_tác_xã thương_mại thành_phố hồ chí_minh sài_gòn co op
208,Lộ diện chủ nhân các giải thưởng cuộc thi “Đổi mới sáng tạo Khởi nghiệp lần 2 năm 2022” tại IUH,Tin tức,lộ diện chủ nhân các giải thưởng cuộc thi đổi mới sáng tạo khởi nghiệp lần năm tại iuh,"['lộ', 'diện', 'chủ_nhân', 'giải_thưởng', 'cuộc', 'thi', 'đổi_mới', 'sáng_tạo', 'khởi_nghiệp', 'lần', 'năm', 'iuh']",lộ diện chủ_nhân giải_thưởng cuộc thi đổi_mới sáng_tạo khởi_nghiệp lần năm iuh
209,Hội Nghị Khoa Học và công nghệ thực phẩm toàn quốc 2023 - Trường Đại học Công nghiệp Tp.HCM (IUH),Tin tức,hội nghị khoa học và công nghệ thực phẩm toàn quốc trường đại học công nghiệp tp hcm iuh,"['hội_nghị', 'khoa_học', 'công_nghệ', 'thực_phẩm', 'toàn_quốc_trường', 'đại_học', 'công_nghiệp', 'tp', 'hcm', 'iuh']",hội_nghị khoa_học công_nghệ thực_phẩm toàn_quốc_trường đại_học công_nghiệp tp hcm iuh
210,Lễ Công bố Quyết định bổ nhiệm viên chức Quản lý,Tin tức,lễ công bố quyết định bổ nhiệm viên chức quản lý,"['lễ', 'công_bố', 'quyết_định', 'bổ_nhiệm', 'viên_chức', 'quản_lý']",lễ công_bố quyết_định bổ_nhiệm viên_chức quản_lý
211,10 sự kiện và thành tựu tiêu biểu năm 2022 của IUH,Tin tức,sự kiện và thành tựu tiêu biểu năm của iuh,"['sự_kiện', 'thành_tựu', 'tiêu_biểu', 'năm', 'iuh']",sự_kiện thành_tựu tiêu_biểu năm iuh
212,Bế mạc khảo sát chính thức kiểm định chất lượng cơ sở giáo dục Trường Đại học Công nghiệp Thành phố Hồ Chí Minh,Tin tức,bế mạc khảo sát chính thức kiểm định chất lượng cơ sở giáo dục trường đại học công nghiệp thành phố hồ chí minh,"['bế_mạc', 'khảo_sát', 'chính_thức', 'kiểm_định', 'chất_lượng', 'cơ_sở', 'giáo_dục', 'trường', 'đại_học', 'công_nghiệp', 'thành_phố', 'hồ', 'chí_minh']",bế_mạc khảo_sát chính_thức kiểm_định chất_lượng cơ_sở giáo_dục trường đại_học công_nghiệp thành_phố hồ chí_minh
213,Khảo sát chính thức kiểm định chất lượng giáo dục chu kỳ 2 tại Trường Đại học Công nghiệp Thành phố Hồ Chí Minh,Tin tức,khảo sát chính thức kiểm định chất lượng giáo dục chu kỳ tại trường đại học công nghiệp thành phố hồ chí minh,"['khảo_sát', 'chính_thức', 'kiểm_định', 'chất_lượng', 'giáo_dục', 'chu_kỳ', 'trường', 'đại_học', 'công_nghiệp', 'thành_phố', 'hồ', 'chí_minh']",khảo_sát chính_thức kiểm_định chất_lượng giáo_dục chu_kỳ trường đại_học công_nghiệp thành_phố hồ chí_minh
214,Sinh viên Khoa Công nghệ Điện xuất sắc giành được giải Á Quân và Quý Quân chung cuộc cuộc thi “Ứng dụng phần mềm SCADA GENESIS64 vào việc số hóa nhà máy”,Tin tức,sinh viên khoa công nghệ điện xuất sắc giành được giải á quân và quý quân chung cuộc cuộc thi ứng dụng phần mềm scada genesis vào việc số hóa nhà máy,"['sinh_viên', 'khoa', 'công_nghệ', 'điện', 'xuất_sắc', 'giành', 'giải', 'á_quân', 'quý_quân', 'chung_cuộc', 'cuộc', 'thi', 'ứng_dụng', 'phần_mềm', 'scada_genesis', 'vào', 'việc', 'số', 'hóa', 'nhà_máy']",sinh_viên khoa công_nghệ điện xuất_sắc giành giải á_quân quý_quân chung_cuộc cuộc thi ứng_dụng phần_mềm scada_genesis vào việc số hóa nhà_máy
215,Trường Đại học Công nghiệp Thành phố Hồ Chí Minh tổ chức khảo sát sơ bộ kiểm định chất lượng cơ sở giáo dục chu kỳ 2,Tin tức,trường đại học công nghiệp thành phố hồ chí minh tổ chức khảo sát sơ bộ kiểm định chất lượng cơ sở giáo dục chu kỳ,"['trường', 'đại_học', 'công_nghiệp', 'thành_phố', 'hồ', 'chí_minh', 'tổ_chức', 'khảo_sát', 'sơ_bộ', 'kiểm_định', 'chất_lượng', 'cơ_sở', 'giáo_dục', 'chu_kỳ']",trường đại_học công_nghiệp thành_phố hồ chí_minh tổ_chức khảo_sát sơ_bộ kiểm_định chất_lượng cơ_sở giáo_dục chu_kỳ
216,Mùa hái quả ngọt tại Trường Đại học Công nghiệp Thành phố Hồ Chí Minh,Tin tức,mùa hái quả ngọt tại trường đại học công nghiệp thành phố hồ chí minh,"['mùa', 'hái', 'quả', 'ngọt', 'trường', 'đại_học', 'công_nghiệp', 'thành_phố', 'hồ', 'chí_minh']",mùa hái quả ngọt trường đại_học công_nghiệp thành_phố hồ chí_minh
217,Hội nghị Quốc tế về Công nghệ tiên tiến trong NN&TP vì sự phát triển bền vững 2022 (FAATSD 2022),Tin tức,hội nghị quốc tế về công nghệ tiên tiến trong nn tp vì sự phát triển bền vững faatsd,"['hội_nghị', 'quốc_tế', 'công_nghệ', 'tiên_tiến', 'nn', 'tp', 'sự', 'phát_triển', 'bền_vững', 'faatsd']",hội_nghị quốc_tế công_nghệ tiên_tiến nn tp sự phát_triển bền_vững faatsd
218,Hơn 800 nhà khoa học tham dự hội nghị quốc tế về công nghệ tiên tiến và phát triển bền vững,Tin tức,hơn nhà khoa học tham dự hội nghị quốc tế về công nghệ tiên tiến và phát triển bền vững,"['nhà_khoa_học', 'tham_dự', 'hội_nghị', 'quốc_tế', 'công_nghệ', 'tiên_tiến', 'phát_triển', 'bền_vững']",nhà_khoa_học tham_dự hội_nghị quốc_tế công_nghệ tiên_tiến phát_triển bền_vững
219,Khai mạc Hội nghị Khoa học Quốc tế lần thứ 2 năm 2022,Tin tức,khai mạc hội nghị khoa học quốc tế lần thứ năm,"['khai_mạc', 'hội_nghị', 'khoa_học', 'quốc_tế', 'lần', 'thứ', 'năm']",khai_mạc hội_nghị khoa_học quốc_tế lần thứ năm
220,Hội nghị tổng kết hoạt động Công đoàn Trường Đại học Công nghiệp Thành phố Hồ Chí Minh năm học 2021 - 2022,Tin tức,hội nghị tổng kết hoạt động công đoàn trường đại học công nghiệp thành phố hồ chí minh năm học,"['hội_nghị', 'tổng_kết', 'hoạt_động', 'công_đoàn', 'trường', 'đại_học', 'công_nghiệp', 'thành_phố', 'hồ', 'chí_minh', 'năm_học']",hội_nghị tổng_kết hoạt_động công_đoàn trường đại_học công_nghiệp thành_phố hồ chí_minh năm_học
221,Trường Đại học Công nghiệp Thành phố Hồ Chí Minh hoàn tất công tác chuẩn bị cho Hội nghị Khoa học Quốc tế lần 2,Tin tức,trường đại học công nghiệp thành phố hồ chí minh hoàn tất công tác chuẩn bị cho hội nghị khoa học quốc tế lần,"['trường', 'đại_học', 'công_nghiệp', 'thành_phố', 'hồ', 'chí_minh', 'hoàn_tất', 'công_tác', 'chuẩn_bị', 'hội_nghị', 'khoa_học', 'quốc_tế', 'lần']",trường đại_học công_nghiệp thành_phố hồ chí_minh hoàn_tất công_tác chuẩn_bị hội_nghị khoa_học quốc_tế lần
222,Chuỗi hoạt động chào mừng kỷ niệm 40 năm ngày Nhà giáo Việt Nam tại trường Đại học Công nghiệp Thành phố Hồ Chí Minh,Tin tức,chuỗi hoạt động chào mừng kỷ niệm năm ngày nhà giáo việt nam tại trường đại học công nghiệp thành phố hồ chí minh,"['chuỗi', 'hoạt_động', 'chào_mừng', 'kỷ_niệm', 'năm', 'ngày', 'nhà_giáo', 'việt_nam', 'trường', 'đại_học', 'công_nghiệp', 'thành_phố', 'hồ', 'chí_minh']",chuỗi hoạt_động chào_mừng kỷ_niệm năm ngày nhà_giáo việt_nam trường đại_học công_nghiệp thành_phố hồ chí_minh
223,Thư chúc mừng nhân kỷ niệm 40 năm ngày Nhà giáo Việt Nam của Bộ trưởng Bộ Công Thương,Tin tức,thư chúc mừng nhân kỷ niệm năm ngày nhà giáo việt nam của bộ trưởng bộ công thương,"['thư', 'chúc_mừng_nhân', 'kỷ_niệm', 'năm', 'ngày', 'nhà_giáo', 'việt_nam', 'bộ_trưởng', 'bộ', 'công_thương']",thư chúc_mừng_nhân kỷ_niệm năm ngày nhà_giáo việt_nam bộ_trưởng bộ công_thương
224,IUH tham gia tổ chức Lập trình Sinh viên Quốc tế ICPC vòng Quốc gia 2022,Tin tức,iuh tham gia tổ chức lập trình sinh viên quốc tế icpc vòng quốc gia,"['iuh', 'tham_gia', 'tổ_chức', 'lập_trình', 'sinh_viên', 'quốc_tế', 'icpc_vòng', 'quốc_gia']",iuh tham_gia tổ_chức lập_trình sinh_viên quốc_tế icpc_vòng quốc_gia
225,“Diễn đàn thông tin về Giáo dục Đại học và Cơ hội nhận được học bổng tại Hungary” tại IUH,Tin tức,diễn đàn thông tin về giáo dục đại học và cơ hội nhận được học bổng tại hungary tại iuh,"['diễn_đàn', 'thông_tin', 'giáo_dục', 'đại_học', 'cơ_hội', 'nhận', 'học_bổng', 'hungary', 'iuh']",diễn_đàn thông_tin giáo_dục đại_học cơ_hội nhận học_bổng hungary iuh
226,Những thay đổi trong tuyển sinh cao học 2022,Tin tức,những thay đổi trong tuyển sinh cao học,"['thay_đổi', 'tuyển_sinh', 'cao_học']",thay_đổi tuyển_sinh cao_học
227,Đại hội hội viên Hội cựu chiến binh trường Đại học Công nghiệp Thành phố Hồ Chí Minh lần thứ V nhiệm kỳ 2022 - 2027,Tin tức,đại hội hội viên hội cựu chiến binh trường đại học công nghiệp thành phố hồ chí minh lần thứ v nhiệm kỳ,"['đại_hội', 'hội_viên', 'hội', 'cựu_chiến_binh', 'trường', 'đại_học', 'công_nghiệp', 'thành_phố', 'hồ', 'chí_minh', 'lần', 'thứ', 'nhiệm_kỳ']",đại_hội hội_viên hội cựu_chiến_binh trường đại_học công_nghiệp thành_phố hồ chí_minh lần thứ nhiệm_kỳ
228,"Lễ vinh danh, khen thưởng các đơn vị, tập thể và các cá nhân có thành tích cao trong công tác NCKHCN năm 2021",Tin tức,lễ vinh danh khen thưởng các đơn vị tập thể và các cá nhân có thành tích cao trong công tác nckhcn năm,"['lễ', 'vinh_danh', 'khen_thưởng', 'đơn_vị', 'tập_thể', 'cá_nhân', 'thành_tích', 'cao', 'công_tác', 'nckhcn', 'năm']",lễ vinh_danh khen_thưởng đơn_vị tập_thể cá_nhân thành_tích cao công_tác nckhcn năm
229,Hội nghị đối thoại giữa lãnh đạo Nhà trường với sinh viên năm 2022,Tin tức,hội nghị đối thoại giữa lãnh đạo nhà trường với sinh viên năm,"['hội_nghị', 'đối_thoại', 'giữa', 'lãnh_đạo', 'nhà_trường', 'sinh_viên', 'năm']",hội_nghị đối_thoại giữa lãnh_đạo nhà_trường sinh_viên năm
230,IUH có thêm 04 chương trình đào tạo đạt chuẩn AUN-QA,Tin tức,iuh có thêm chương trình đào tạo đạt chuẩn aun qa,"['iuh', 'thêm', 'chương_trình', 'đào_tạo', 'đạt', 'chuẩn', 'aun', 'qa']",iuh thêm chương_trình đào_tạo đạt chuẩn aun qa
231,Hội nghị Tổ chức hoạt động tuyên truyền kỷ niệm 87 năm ngày truyền thống dân quân tự vệ Việt Nam (28/03/1935 – 28/03/2022),Tin tức,hội nghị tổ chức hoạt động tuyên truyền kỷ niệm năm ngày truyền thống dân quân tự vệ việt nam,"['hội_nghị', 'tổ_chức', 'hoạt_động', 'tuyên_truyền', 'kỷ_niệm', 'năm', 'ngày', 'truyền_thống', 'dân_quân', 'tự_vệ', 'việt_nam']",hội_nghị tổ_chức hoạt_động tuyên_truyền kỷ_niệm năm ngày truyền_thống dân_quân tự_vệ việt_nam
232,D-Health đoạt giải nhất Cuộc thi INNOGREENLIFE 2021,Tin tức,d health đoạt giải nhất cuộc thi innogreenlife,"['health', 'đoạt', 'giải', 'nhất', 'cuộc', 'thi', 'innogreenlife']",health đoạt giải nhất cuộc thi innogreenlife
233,"Lễ Tổng kết Cuộc thi “Đổi mới sáng tạo vì cuộc sống Xanh"" - INNOGREENLIFE2021",Tin tức,lễ tổng kết cuộc thi đổi mới sáng tạo vì cuộc sống xanh innogreenlife,"['lễ', 'tổng_kết', 'cuộc', 'thi', 'đổi_mới', 'sáng_tạo', 'cuộc_sống', 'xanh', 'innogreenlife']",lễ tổng_kết cuộc thi đổi_mới sáng_tạo cuộc_sống xanh innogreenlife
234,"IUH tổ chức Lễ khai giảng đào tạo trình độ Tiến sĩ khoá 5, Thạc sĩ khoá 11 và trao bằng tốt nghiệp năm 2021",Tin tức,iuh tổ chức lễ khai giảng đào tạo trình độ tiến sĩ khoá thạc sĩ khoá và trao bằng tốt nghiệp năm,"['iuh', 'tổ_chức', 'lễ', 'khai_giảng', 'đào_tạo', 'trình_độ', 'tiến_sĩ', 'khóa', 'thạc_sĩ', 'khóa', 'trao', 'bằng', 'tốt_nghiệp', 'năm']",iuh tổ_chức lễ khai_giảng đào_tạo trình_độ tiến_sĩ khóa thạc_sĩ khóa trao bằng tốt_nghiệp năm
235,Đảng bộ trường hoàn thành xuất sắc nhiệm vụ năm học 2020 - 2021,Tin tức,đảng bộ trường hoàn thành xuất sắc nhiệm vụ năm học,"['đảng_bộ', 'trường', 'hoàn_thành', 'xuất_sắc', 'nhiệm_vụ', 'năm_học']",đảng_bộ trường hoàn_thành xuất_sắc nhiệm_vụ năm_học
236,Cử nhân Ngành kế toán – Kiểm toán IUH lọt TOP 5% các trường đáp ứng các yêu cầu của Hiệp hội kế toán công chứng ÚC,Tin tức,cử nhân ngành kế toán kiểm toán iuh lọt top các trường đáp ứng các yêu cầu của hiệp hội kế toán công chứng úc,"['cử_nhân', 'ngành', 'kế_toán', 'kiểm_toán', 'iuh', 'lọt_top', 'trường', 'đáp_ứng', 'yêu_cầu', 'hiệp_hội', 'kế_toán', 'công_chứng', 'úc']",cử_nhân ngành kế_toán kiểm_toán iuh lọt_top trường đáp_ứng yêu_cầu hiệp_hội kế_toán công_chứng úc
237,IUH mở ngành Dược học,Tin tức,iuh mở ngành dược học,"['iuh', 'mở', 'ngành', 'dược_học']",iuh mở ngành dược_học
238,Thư chúc mừng Ngày Quốc tế Phụ nữ của Hiệu trưởng IUH,Tin tức,thư chúc mừng ngày quốc tế phụ nữ của hiệu trưởng iuh,"['thư', 'chúc_mừng', 'ngày', 'quốc_tế_phụ_nữ', 'hiệu_trưởng', 'iuh']",thư chúc_mừng ngày quốc_tế_phụ_nữ hiệu_trưởng iuh
239,"Công nghệ Kỹ thuật Nhiệt - Ngành chưa bao giờ hết ""HOT""",Tin tức,công nghệ kỹ thuật nhiệt ngành chưa bao giờ hết hot,"['công_nghệ', 'kỹ_thuật', 'nhiệt', 'ngành', 'chưa', 'bao_giờ', 'hết', 'hot']",công_nghệ kỹ_thuật nhiệt ngành chưa bao_giờ hết hot
240,IUH đạt Giải Ba cuộc thi Dự án kỹ thuật phục vụ cộng đồng (EPICS),Tin tức,iuh đạt giải ba cuộc thi dự án kỹ thuật phục vụ cộng đồng epics,"['iuh', 'đạt', 'giải', 'ba', 'cuộc', 'thi', 'dự_án', 'kỹ_thuật', 'phục_vụ', 'cộng_đồng', 'epics']",iuh đạt giải ba cuộc thi dự_án kỹ_thuật phục_vụ cộng_đồng epics
241,Hội thảo khoa học lần 3: Sinh viên với xu hướng phát triển ngành kỹ thuật nhiệt trong thời đại 4.0,Tin tức,hội thảo khoa học lần sinh viên với xu hướng phát triển ngành kỹ thuật nhiệt trong thời đại,"['hội_thảo', 'khoa_học', 'lần', 'sinh_viên', 'xu_hướng', 'phát_triển', 'ngành', 'kỹ_thuật', 'nhiệt', 'thời_đại']",hội_thảo khoa_học lần sinh_viên xu_hướng phát_triển ngành kỹ_thuật nhiệt thời_đại
242,Hội thảo các nghiên cứu tiên tiến trong khoa học nhiệt và lưu chất,Tin tức,hội thảo các nghiên cứu tiên tiến trong khoa học nhiệt và lưu chất,"['hội_thảo', 'nghiên_cứu', 'tiên_tiến', 'khoa_học_nhiệt', 'lưu_chất']",hội_thảo nghiên_cứu tiên_tiến khoa_học_nhiệt lưu_chất
243,Sinh viên IUH chung tay chống dịch COVID–19,Tin tức,sinh viên iuh chung tay chống dịch covid,"['sinh_viên', 'iuh', 'chung', 'tay', 'chống', 'dịch', 'covid']",sinh_viên iuh chung tay chống dịch covid
244,"Thư động viên của Bộ trưởng Bộ Công Thương gửi cán bộ, công chức, viên chức, người lao động các đơn vị thuộc bộ tại các tỉnh, thành có dịch",Tin tức,thư động viên của bộ trưởng bộ công thương gửi cán bộ công chức viên chức người lao động các đơn vị thuộc bộ tại các tỉnh thành có dịch,"['thư', 'động_viên', 'bộ_trưởng', 'bộ', 'công_thương', 'gửi', 'cán_bộ', 'công_chức', 'viên_chức', 'người', 'lao_động', 'đơn_vị', 'thuộc', 'bộ', 'tỉnh_thành', 'dịch']",thư động_viên bộ_trưởng bộ công_thương gửi cán_bộ công_chức viên_chức người lao_động đơn_vị thuộc bộ tỉnh_thành dịch
245,"Hội nghị Khoa học trẻ lần 3 năm 2021: ""Tri thức trẻ thời đại 4.0""",Tin tức,hội nghị khoa học trẻ lần năm tri thức trẻ thời đại,"['hội_nghị', 'khoa_học', 'trẻ', 'lần', 'năm', 'tri_thức', 'trẻ', 'thời_đại']",hội_nghị khoa_học trẻ lần năm tri_thức trẻ thời_đại
246,Top 5- Bước đột phá của IUH trên bảng xếp hạng Webometrics,Tin tức,top bước đột phá của iuh trên bảng xếp hạng webometrics,"['top', 'bước', 'đột_phá', 'iuh', 'trên', 'bảng', 'xếp_hạng', 'webometrics']",top bước đột_phá iuh trên bảng xếp_hạng webometrics
247,IUH chung tay đẩy lùi dịch bệnh Covid-19,Tin tức,iuh chung tay đẩy lùi dịch bệnh covid,"['iuh', 'chung', 'tay', 'đẩy_lùi', 'dịch_bệnh', 'covid']",iuh chung tay đẩy_lùi dịch_bệnh covid
248,Hội thi “Kiến trúc trẻ 2021” – Sân chơi học thuật mới lạ mùa Covid,Tin tức,hội thi kiến trúc trẻ sân chơi học thuật mới lạ mùa covid,"['hội', 'thi', 'kiến_trúc', 'trẻ', 'sân_chơi', 'học_thuật', 'mới_lạ', 'mùa', 'covid']",hội thi kiến_trúc trẻ sân_chơi học_thuật mới_lạ mùa covid
249,Hội thảo nghiên cứu khoa học sinh viên Khoa Quản trị kinh doanh - IUHBASS III,Tin tức,hội thảo nghiên cứu khoa học sinh viên khoa quản trị kinh doanh iuhbass iii,"['hội_thảo', 'nghiên_cứu', 'khoa_học_sinh_viên', 'khoa', 'quản_trị', 'kinh_doanh', 'iuhbass', 'iii']",hội_thảo nghiên_cứu khoa_học_sinh_viên khoa quản_trị kinh_doanh iuhbass iii
250,Hội thảo nghiên cứu khoa học sinh viên - Khoa Thương mại và Du lịch lần thứ 2 năm 2021,Tin tức,hội thảo nghiên cứu khoa học sinh viên khoa thương mại và du lịch lần thứ năm,"['hội_thảo', 'nghiên_cứu', 'khoa_học_sinh_viên', 'khoa', 'thương_mại', 'du_lịch', 'lần', 'thứ', 'năm']",hội_thảo nghiên_cứu khoa_học_sinh_viên khoa thương_mại du_lịch lần thứ năm
251,IUH tổ chức đánh giá nội bộ trực tuyến 04 chương trình đào tạo năm 2021,Tin tức,iuh tổ chức đánh giá nội bộ trực tuyến chương trình đào tạo năm,"['iuh', 'tổ_chức', 'đánh_giá', 'nội_bộ', 'trực_tuyến', 'chương_trình', 'đào_tạo', 'năm']",iuh tổ_chức đánh_giá nội_bộ trực_tuyến chương_trình đào_tạo năm
252,Khoa Tài chính - Ngân hàng tổ chức Hội nghị Khoa học sinh viên năm 2021,Tin tức,khoa tài chính ngân hàng tổ chức hội nghị khoa học sinh viên năm,"['khoa', 'tài_chính', 'ngân_hàng', 'tổ_chức', 'hội_nghị', 'khoa_học_sinh_viên', 'năm']",khoa tài_chính ngân_hàng tổ_chức hội_nghị khoa_học_sinh_viên năm
253,IUH chào đón ngày hội lớn,Tin tức,iuh chào đón ngày hội lớn,"['iuh', 'chào_đón', 'ngày', 'hội', 'lớn']",iuh chào_đón ngày hội lớn
254,Hội thảo định hướng nghiên cứu luận văn thạc sĩ – Ngành Quản trị kinh doanh,Tin tức,hội thảo định hướng nghiên cứu luận văn thạc sĩ ngành quản trị kinh doanh,"['hội_thảo', 'định_hướng', 'nghiên_cứu', 'luận_văn', 'thạc_sĩ', 'ngành', 'quản_trị', 'kinh_doanh']",hội_thảo định_hướng nghiên_cứu luận_văn thạc_sĩ ngành quản_trị kinh_doanh
255,Diễn đàn “Quyền Sở hữu trí tuệ với doanh nghiệp nhỏ và vừa” tại thành phố Hồ Chí Minh,Tin tức,diễn đàn quyền sở hữu trí tuệ với doanh nghiệp nhỏ và vừa tại thành phố hồ chí minh,"['diễn_đàn', 'quyền', 'sở_hữu_trí_tuệ', 'doanh_nghiệp', 'nhỏ', 'vừa', 'thành_phố', 'hồ', 'chí_minh']",diễn_đàn quyền sở_hữu_trí_tuệ doanh_nghiệp nhỏ vừa thành_phố hồ chí_minh
256,Tập huấn phát triển chỉ số đo lường và đánh giá (KPIs),Tin tức,tập huấn phát triển chỉ số đo lường và đánh giá kpis,"['tập_huấn', 'phát_triển', 'chỉ_số', 'đo_lường', 'đánh_giá', 'kpis']",tập_huấn phát_triển chỉ_số đo_lường đánh_giá kpis
